name,total
"Cum inventore nihil id mollitia.",64
"Quam aut voluptas veniam qui.",56
"Nihil fugit perspiciatis inventore commodi.",49
"Nihil adipisci ab quisquam aut.",53
"Ut rerum architecto ea sunt.",56
"Cum voluptate corporis quis molestiae.",58
"Eius dicta eaque hic itaque.",56
"Omnis sunt quo ipsa ullam.",58
"Delectus est consequatur et eligendi.",63
"Id iusto molestias voluptatem et.",71
"Dignissimos reiciendis ex alias ut.",67
"Mollitia distinctio omnis placeat voluptatem.",54
"Autem quia fugiat doloribus dolorem.",46
"Eum laboriosam tempora illo sit.",61
"Quis sit sint soluta voluptates.",67
"Et odio voluptatem iusto illum.",65
"Quibusdam est voluptatem ea eos.",41
"Libero nam quia dolores tempora.",75
"Placeat consequatur soluta blanditiis vitae.",60
"Vero enim itaque quisquam quibusdam.",62
"Optio neque odio recusandae ut.",60
"Est aut sed eos nostrum.",54
"Ea molestias laborum nihil doloremque.",60
"Quia quia voluptatem in earum.",73
"Impedit nam dignissimos ut non.",63
"Ad porro ut eveniet facilis.",69
"Totam sequi quia sunt id.",57
"Voluptatum non qui molestiae aut.",50
"Harum voluptatem excepturi et consequatur.",61
"Rerum voluptatibus voluptatem deserunt molestias.",48
"Numquam voluptatum quo nobis incidunt.",67
"Expedita quia ipsam nihil sit.",73
"Et ut harum et qui.",64
"Voluptas voluptatibus vel ut amet.",46
"Amet veritatis vel quis est.",56
"Et id aut est eos.",62
"Officia atque autem doloremque laborum.",60
"Necessitatibus eligendi quasi voluptas eos.",52
"Incidunt numquam hic ut animi.",59
"Quia quis occaecati omnis fugiat.",44
"Nihil occaecati sit harum impedit.",52
"Et omnis ad in officiis.",71
"Neque placeat esse aut nesciunt.",54
"Excepturi necessitatibus quod dolorum voluptates.",60
"Est aliquam est optio adipisci.",75
"Quod sint omnis praesentium quo.",63
"Ut nihil esse est inventore.",61
"Id doloribus sit quia tempore.",71
"Soluta nihil dolores unde aut.",63
"Corporis illum sit ullam nihil.",63
"Dignissimos eos soluta quae explicabo.",71
"Aperiam sed nam excepturi ut.",60
"Non quidem esse ut distinctio.",62
"Eum aspernatur qui quibusdam dignissimos.",61
"Occaecati qui eligendi voluptatem labore.",60
"Corrupti vitae est quasi eaque.",57
"Aut impedit maxime enim sit.",59
"Exercitationem reiciendis rerum culpa voluptatem.",82
"Sed qui et fuga veniam.",61
"Cumque architecto quisquam error velit.",59
"Fugit dolores ipsum natus dolorem.",67
"Illum eligendi delectus sed blanditiis.",47
"Rerum ut accusamus et optio.",57
"Recusandae labore voluptatem illum illum.",60
"Ea qui delectus et ipsam.",64
"Exercitationem in placeat provident architecto.",52
"Dolores facere accusantium numquam libero.",68
"Repudiandae nulla labore repudiandae dolor.",58
"Aut vel inventore praesentium officia.",63
"Alias ducimus culpa ipsam perspiciatis.",63
"Impedit quae accusantium reiciendis eum.",51
"At repellendus beatae nesciunt qui.",45
"Molestiae consectetur porro vitae expedita.",52
"Rerum est et molestias quisquam.",69
"Non expedita quas hic ipsum.",63
"Sed laudantium nam qui optio.",44
"Nesciunt accusamus nobis dolores libero.",53
"Odio suscipit molestiae voluptatem dolore.",54
"Molestiae quasi voluptatum iure ducimus.",52
"Qui sit ut qui molestiae.",63
"Natus placeat aliquam facilis modi.",56
"Sapiente quos laudantium temporibus omnis.",51
"Soluta dignissimos qui harum et.",67
"Voluptatem iure est et et.",57
"Accusantium animi quis hic tenetur.",47
"Enim voluptas veritatis eos beatae.",52
"Saepe autem quia ut voluptatem.",58
"Nemo consectetur minus earum omnis.",65
"Consequatur quis molestiae doloremque ut.",59
"Animi ut quae qui odit.",55
"Saepe distinctio repellat est inventore.",64
"Ab qui aut harum magni.",60
"Impedit quia optio ea enim.",64
"Temporibus eaque magnam ducimus placeat.",64
"Repellendus vitae cum eos quae.",51
"Natus et reiciendis ad exercitationem.",42
"Est dolorem amet illo enim.",62
"Modi ea quas autem nam.",60
"Sint velit aut aut fugit.",66
"Illum quia consequatur quia sed.",62
"Consequatur sed ut nobis quas.",61
"Consequatur hic natus dolorem et.",67
"Aut dolorum consequuntur et ut.",56
"Adipisci qui quibusdam tenetur accusantium.",55
"Aut et velit molestiae omnis.",61
"Ut tempora id et dolor.",58
"Sapiente quo blanditiis maiores non.",65
"Autem placeat officiis dicta iste.",52
"Accusamus optio fuga esse laborum.",69
"At hic qui maiores accusantium.",63
"Non est aut omnis iusto.",67
"Commodi cum tenetur soluta enim.",68
"Recusandae vero pariatur esse eos.",46
"Maiores quos labore voluptas tempore.",66
"Velit tempore fuga iure beatae.",50
"Qui quae distinctio repudiandae impedit.",61
"Repellat aut nam ipsum qui.",61
"Saepe reiciendis voluptatem tempora ut.",65
"Iure expedita quia velit reiciendis.",63
"Accusantium in iusto deserunt nesciunt.",71
"Molestiae omnis voluptate repellendus libero.",58
"Delectus architecto esse sunt voluptatibus.",52
"Aliquid sit corporis soluta quaerat.",70
"Cupiditate provident accusantium quia eos.",59
"Neque sint et doloribus quibusdam.",67
"Vel mollitia eaque modi eum.",66
"Aspernatur quae at deleniti porro.",65
"Maxime atque rerum quam vero.",51
"Est harum aut qui ea.",62
"Itaque consequatur explicabo vel quae.",59
"Ullam alias neque dolore fuga.",73
"Ipsam placeat praesentium fuga ut.",62
"Commodi qui sunt aut ducimus.",57
"Aliquam sunt dolorem tenetur necessitatibus.",51
"Ut soluta molestiae et ducimus.",58
"Ea cupiditate ullam dolorum est.",68
"Placeat molestias architecto ipsum laboriosam.",64
"Voluptatibus voluptatem repudiandae at qui.",55
"Reprehenderit aspernatur occaecati aliquam temporibus.",51
"Numquam ea accusamus perspiciatis dignissimos.",67
"Beatae omnis eos culpa quae.",54
"Quam consequatur ea laborum inventore.",44
"Nemo est reiciendis modi reprehenderit.",45
"Distinctio assumenda et voluptas labore.",66
"Recusandae distinctio perspiciatis harum nostrum.",54
"Vel suscipit odit et culpa.",72
"Qui pariatur dignissimos cupiditate ipsum.",54
"Nobis voluptatem expedita quis maiores.",55
"Non ut ipsum necessitatibus qui.",58
"Sunt et eum incidunt cupiditate.",52
"Saepe perspiciatis nostrum sint quas.",52
"Aut suscipit quis natus corporis.",57
"Dolor voluptatum doloremque amet quidem.",62
"Et qui officia earum non.",46
"Qui quos quis consequatur autem.",43
"Cumque rerum aliquam officia repellendus.",59
"Velit magni cupiditate nulla occaecati.",61
"Atque porro inventore omnis rerum.",49
"Deserunt magni et et consequatur.",57
"Sit minima quo maxime aperiam.",63
"Necessitatibus optio voluptas saepe quam.",64
"Rem amet a optio ut.",61
"Sit omnis alias facere delectus.",62
"Odit minus commodi sint non.",58
"Odio doloremque libero unde ducimus.",39
"Modi et odit id illum.",59
"Illum nihil et a iste.",61
"Aut error mollitia odit ipsam.",67
"Illum et autem temporibus est.",68
"Quia nam commodi nihil quos.",59
"Modi ullam quod et laborum.",58
"Omnis cum minus aut neque.",64
"Placeat excepturi qui rerum saepe.",57
"Voluptatum assumenda possimus quod sequi.",60
"Error veniam nemo asperiores officiis.",77
"Nemo doloribus et mollitia et.",60
"Occaecati distinctio et ipsa dicta.",63
"Temporibus hic voluptas eos voluptas.",56
"Quod animi quam sed quod.",65
"Qui similique vero consequuntur blanditiis.",58
"Officiis minus quae earum tenetur.",57
"Error accusantium voluptas quia quae.",61
"Minima alias veniam laborum architecto.",59
"Praesentium qui totam molestiae ab.",77
"Vel minus distinctio aut quaerat.",59
"Officiis eos enim blanditiis aliquid.",62
"Dicta voluptatem veritatis pariatur eveniet.",50
"Omnis et rem iste laboriosam.",64
"Provident ea voluptatem dicta eius.",73
"Non alias qui mollitia facilis.",66
"Nostrum soluta consequuntur doloribus eligendi.",72
"Incidunt accusamus beatae enim fugiat.",57
"Quo est ad aut sed.",62
"Omnis est illo unde dignissimos.",59
"Ut impedit ad amet tenetur.",61
"Nostrum sed maiores ipsam cupiditate.",60
"Ut in veritatis magni dolorem.",56
"Quo similique similique perspiciatis voluptate.",65
"Totam illo suscipit voluptate dolore.",54
"Nesciunt quaerat velit qui occaecati.",57
"Eaque quo enim voluptas unde.",57
"Velit quod omnis molestiae labore.",70
"Est consectetur maiores iusto temporibus.",62
"Sint nisi magnam corporis voluptas.",54
"Unde dolores voluptatem cum dicta.",61
"Perspiciatis dolores sit iusto itaque.",63
"Suscipit sit et dignissimos ad.",51
"Quia dolores nobis perspiciatis quo.",82
"Eum est nihil ipsam et.",41
"Laudantium saepe consequatur quae totam.",46
"Quia et sed enim dolorum.",50
"Nostrum corporis omnis laborum pariatur.",60
"Eos corporis qui aliquid velit.",49
"Quo officiis id et ut.",66
"Ipsum vero magnam repellendus blanditiis.",59
"Molestiae vitae commodi blanditiis architecto.",56
"Sunt eligendi nam unde veritatis.",52
"Ipsam veniam voluptas ipsam officiis.",66
"Mollitia voluptates minima quia porro.",50
"Quasi iure qui quo praesentium.",69
"Quae in quaerat qui inventore.",64
"Deleniti quos earum libero impedit.",52
"Ipsum harum inventore odio et.",58
"Est distinctio distinctio tempora repellat.",64
"Architecto dolorem laboriosam accusantium eveniet.",71
"Quod unde sequi accusantium enim.",59
"Voluptatem et sed officiis ut.",55
"Deleniti quas sint aperiam placeat.",66
"Quia enim dolorem qui eligendi.",49
"Qui voluptas qui corrupti ducimus.",59
"A iure amet aut numquam.",55
"Ea aut dolorum repellendus quas.",63
"Mollitia tempora quo similique blanditiis.",55
"Et distinctio et ea labore.",65
"Voluptas debitis expedita itaque harum.",61
"Reprehenderit eos dolorum repellat saepe.",64
"Beatae quidem distinctio libero suscipit.",64
"Mollitia illum rerum sapiente quia.",63
"Repellat officiis est nulla sequi.",58
"Voluptas aliquid laudantium sed quis.",61
"Et et autem magnam qui.",58
"In rerum ea optio voluptas.",55
"Tempore rem quibusdam quo est.",63
"Non qui quia ipsam eum.",62
"Pariatur illum rerum rerum iusto.",44
"Et est excepturi et et.",50
"Quia eveniet debitis optio quas.",57
"Itaque tempora occaecati officia minus.",61
"Deserunt culpa dolor reiciendis amet.",57
"Veniam nam quibusdam voluptas distinctio.",56
"Voluptas amet consequatur in laboriosam.",70
"Ut beatae ut eveniet ut.",56
"Asperiores et ut non eaque.",62
"Minima nemo quasi qui est.",51
"Similique ut quo est distinctio.",61
"Doloribus ratione natus sit aspernatur.",53
"Consequatur cupiditate dolor assumenda ut.",53
"Quidem voluptatem deserunt iure fuga.",67
"Ut sit quaerat consequatur ea.",58
"Soluta commodi ut ipsum dolorem.",54
"Sunt esse quisquam quidem voluptatem.",52
"Saepe officia enim quia illo.",70
"Qui sit nisi nostrum id.",61
"Assumenda mollitia sint eum quaerat.",61
"Qui exercitationem vel placeat voluptatibus.",55
"Ut eaque ad quibusdam repellendus.",46
"Quia libero voluptate dignissimos fugit.",57
"Velit totam tenetur unde accusamus.",60
"Suscipit autem corrupti sint assumenda.",64
"Ut voluptatem dolorum harum aut.",54
"Tempora blanditiis quaerat possimus numquam.",44
"Suscipit eveniet iure aut qui.",51
"Eveniet ullam assumenda tempore consectetur.",69
"Perspiciatis labore quia quia incidunt.",56
"Pariatur cupiditate quibusdam ut aspernatur.",54
"Eos sit cumque officia totam.",45
"Consequatur voluptas qui fuga vero.",53
"Consequatur velit in sed quia.",53
"Voluptate reprehenderit tempora et reprehenderit.",67
"Placeat iusto aut dolore aliquam.",57
"Illo esse dolorem doloremque quisquam.",58
"Fugiat perspiciatis officia fugit laudantium.",54
"Neque quasi ut dolores distinctio.",65
"Voluptatum a quia aut et.",55
"Laborum voluptatibus expedita ea vel.",52
"Aliquam harum quia maiores eum.",57
"Non et quo at nobis.",63
"Tempora corrupti molestias recusandae explicabo.",66
"Hic dolores error aperiam nobis.",65
"Rerum nihil nihil et est.",55
"Molestiae quo ab enim eius.",46
"Et quo natus voluptatum id.",60
"Sed dolorem non qui cum.",51
"Aut fugit ipsa non molestiae.",59
"Tempore quis fugiat eveniet natus.",62
"Molestiae dolores dicta deleniti labore.",49
"Ipsum sunt unde dolore dolor.",65
"Eos vitae enim qui rem.",67
"Perferendis odio nihil deserunt rem.",59
"Nesciunt beatae iure tempore quis.",61
"Maiores ut ducimus consequatur autem.",50
"Accusamus delectus accusantium minima placeat.",52
"Sapiente omnis modi magni eos.",60
"Repellendus aspernatur dolor vitae iure.",56
"Delectus omnis sunt iste ea.",63
"Ipsum in beatae quia doloribus.",58
"Minus voluptatem molestiae consequatur eum.",77
"Dolores enim dolor autem nemo.",62
"Ea optio aut nisi iusto.",63
"Aut pariatur fuga optio ut.",68
"Nesciunt nulla neque ad assumenda.",71
"Excepturi nulla doloribus non beatae.",52
"Necessitatibus sapiente error ut aut.",63
"Fuga voluptatem exercitationem dolorum aliquid.",58
"Dolores voluptas tempore qui dolores.",51
"Enim aperiam exercitationem quia nobis.",62
"Aut vel et vero est.",63
"Ut harum omnis modi autem.",62
"Non vitae asperiores dolor debitis.",55
"Qui sed ea labore corrupti.",58
"Eos recusandae nostrum sapiente assumenda.",54
"Blanditiis delectus reprehenderit delectus voluptas.",68
"Laboriosam quasi rerum dolore praesentium.",60
"Maxime voluptatem tempora ut est.",65
"Voluptatem dolorem minus quis reprehenderit.",64
"Blanditiis voluptatibus autem debitis sint.",58
"Labore corrupti saepe molestiae fugiat.",64
"Repudiandae qui hic corporis quod.",55
"Autem fuga ullam impedit qui.",54
"Quam id voluptatem voluptas iure.",47
"Tenetur quas laborum ut autem.",56
"Quaerat culpa in ut consequatur.",76
"Delectus qui dolorem consequatur asperiores.",53
"Deleniti qui accusamus nulla natus.",68
"Labore quia et quam non.",58
"Fugiat doloremque numquam consequatur ut.",57
"Officiis dolores quaerat reiciendis consequatur.",49
"Possimus maxime fuga placeat consequatur.",70
"Ut quos aut quos quis.",50
"Sed odit quo totam recusandae.",59
"Iure debitis quis commodi perspiciatis.",56
"Quo magni eaque sit laboriosam.",52
"Accusantium id nisi voluptate deleniti.",50
"Sed et dolor distinctio fuga.",54
"Enim eligendi non quis tenetur.",67
"Quia quibusdam quia minus id.",47
"Accusantium eum delectus vitae est.",59
"Unde consectetur possimus et eum.",51
"Autem sint nam ea odit.",45
"Quas illum est numquam aliquid.",61
