name,total
"Sed similique sequi ut magnam.",63
"Vero voluptate quis unde mollitia.",48
"Occaecati corrupti molestiae ut modi.",65
"Ut unde pariatur explicabo qui.",59
"Totam modi omnis rerum magnam.",51
"Blanditiis est blanditiis et vel.",56
"Veniam eos nemo consequatur cupiditate.",48
"Quia delectus quia enim delectus.",53
"Aliquid voluptatem unde eum earum.",53
"Porro illo est saepe dolores.",67
"Cumque voluptas blanditiis aut eum.",55
"Qui quo et nemo modi.",54
"Ut nisi officia ut dolor.",67
"Quas nam laboriosam provident eaque.",59
"Et mollitia nostrum explicabo modi.",50
"Ipsam itaque illo corrupti et.",65
"Maxime quidem animi repudiandae ullam.",51
"Consectetur sint consequuntur autem aliquam.",53
"Ullam sunt aut eaque sint.",60
"Distinctio ex et ex suscipit.",56
"Doloremque ratione velit sit alias.",70
"Quam quia aut nam sit.",69
"Maiores eius eaque veritatis ullam.",59
"Perspiciatis ut voluptatibus dolor dolor.",53
"Rerum pariatur qui accusamus corrupti.",48
"Expedita ut et sapiente ullam.",55
"Eum ratione magni quidem dignissimos.",48
"Deleniti iste cum nesciunt ea.",56
"Iure non praesentium nobis sit.",55
"Expedita omnis iusto sint veritatis.",52
"Consequuntur omnis est consectetur et.",63
"Et expedita voluptates eum aut.",58
"Hic corporis in assumenda quia.",58
"Eaque ut porro repellendus quod.",57
"Sit quia voluptatem saepe consectetur.",66
"Velit similique eum earum et.",59
"Unde veritatis et magni fugit.",59
"Molestias non eos sunt esse.",61
"Officiis quae perferendis dolores laudantium.",57
"Tempore sed quo autem alias.",76
"Ut mollitia sint cum non.",62
"Ab nemo possimus omnis aperiam.",53
"Iure expedita nihil ratione omnis.",69
"Ut aut enim neque placeat.",76
"Enim repellendus molestiae est quo.",74
"Nemo amet quibusdam quia et.",64
"Sunt odio sit nemo a.",67
"Cupiditate nobis sunt aut minima.",52
"Magnam velit quis in accusamus.",57
"Eligendi dignissimos ut aperiam est.",58
"Quia labore aliquid praesentium odio.",68
"Dolorum nihil adipisci dolore ut.",62
"Eum inventore molestias voluptas quam.",63
"Sunt saepe nihil dolores odio.",60
"Vel perspiciatis quos et odio.",55
"Ipsa et animi velit non.",63
"Nobis est natus quod atque.",65
"Esse voluptatem consequatur illum quod.",64
"Laudantium architecto voluptatem delectus provident.",67
"Perferendis aut omnis rerum aut.",71
"Autem ut quibusdam ad quas.",43
"Optio corrupti voluptatem nisi vel.",46
"Dolores illum eius voluptate nesciunt.",59
"Quia voluptas modi autem maxime.",62
"Aspernatur esse eius fugiat iure.",60
"Quidem molestiae aut voluptatem omnis.",70
"Pariatur corporis sed fugiat earum.",71
"Voluptatem et est odit dolor.",57
"Cum repudiandae nihil soluta est.",58
"Ducimus earum saepe harum omnis.",70
"Illo et facere aperiam quo.",67
"Est atque sed natus ipsam.",50
"Modi repellat impedit occaecati ex.",64
"Similique culpa cupiditate suscipit facilis.",64
"Quo voluptas sit sit odit.",69
"Id optio et possimus nostrum.",57
"Nisi nisi voluptas ipsa dignissimos.",61
"Est modi ullam dolores sunt.",85
"Quia consectetur nostrum laudantium delectus.",59
"Est eligendi et quae neque.",50
"Velit fugit adipisci dolor voluptatem.",65
"Voluptatem nihil itaque optio recusandae.",66
"Eos rerum consequatur placeat itaque.",64
"Quis fuga dolorem dolor enim.",72
"Eligendi adipisci totam sit itaque.",55
"Ut impedit officiis perspiciatis amet.",76
"Nostrum libero aut voluptatum harum.",62
"Vel aut nostrum iusto facilis.",58
"Eius voluptate quo est et.",62
"Aliquid illo eos nobis nobis.",59
"Aperiam esse non ut ea.",71
"Numquam illum quia quia expedita.",66
"Deserunt inventore nihil possimus quidem.",64
"Nisi laborum laudantium unde recusandae.",59
"Quod repellendus et dicta dolorem.",57
"Repellat voluptates ut nesciunt deleniti.",53
"Velit sit accusamus reprehenderit aut.",52
"Tempore necessitatibus eligendi quisquam odit.",63
"Quas nulla commodi vitae quisquam.",59
"Officiis consequatur non reprehenderit culpa.",68
"Neque voluptatem aliquam sed qui.",66
"Atque sunt ipsum est qui.",71
"Est corporis fuga perferendis deserunt.",46
"Deleniti officiis commodi nesciunt velit.",58
"Nulla quia neque omnis sed.",43
"Vel et ducimus nostrum temporibus.",52
"Pariatur rerum repellat deserunt reprehenderit.",55
"Reprehenderit dolor eaque quis ipsum.",64
"Culpa eos sapiente qui excepturi.",51
"Ratione corrupti consequatur recusandae tenetur.",57
"Molestiae quo suscipit magnam atque.",53
"Molestiae et sapiente at quasi.",65
"Qui amet temporibus debitis accusamus.",62
"Iusto itaque et temporibus voluptates.",53
"Tempore quo cum molestiae accusamus.",61
"Porro consectetur labore possimus consectetur.",62
"Dolorum consequatur facilis corporis et.",63
"A tempore possimus tenetur voluptatum.",64
"Tempore ea ipsum eligendi minima.",59
"Voluptas et mollitia qui asperiores.",47
"Rerum provident eum tenetur ipsam.",52
"Id perspiciatis amet qui occaecati.",77
"Voluptas quod omnis et fugiat.",50
"Ratione fugiat asperiores laborum ut.",63
"Explicabo nisi non praesentium asperiores.",69
"Voluptate voluptates eaque neque ex.",48
"Non sequi autem porro facilis.",50
"Assumenda esse nihil distinctio qui.",44
"Placeat officiis eos labore autem.",60
"Commodi inventore et in velit.",67
"Nesciunt ad deleniti eum nulla.",61
"Consectetur eligendi non quia aperiam.",75
"Rerum inventore dolor impedit autem.",50
"Aut qui officiis nisi dolores.",51
"Quia repellendus eum sequi accusantium.",52
"Architecto ullam a cumque nihil.",61
"Nemo et culpa doloremque in.",63
"Dolores dignissimos molestias consequatur tempore.",59
"Aut neque veritatis rerum ut.",71
"Tenetur libero rerum est fugiat.",69
"Voluptatibus rem atque explicabo velit.",56
"Voluptas libero ut qui error.",74
"Itaque dolores odio sit voluptates.",57
"Et libero dolorem quis vel.",65
"Tenetur magnam harum enim harum.",46
"Dignissimos dolores possimus omnis accusantium.",56
"Occaecati repudiandae illo quo iste.",48
"Sint recusandae non eum quod.",46
"Vitae maxime autem aut repellendus.",54
"Totam repellendus totam beatae consectetur.",66
"Consequatur vero accusamus magni placeat.",56
"Quos suscipit aut ad nostrum.",57
"Omnis ut fuga nostrum eligendi.",65
"Doloremque eos reprehenderit quis sit.",66
"Consectetur culpa aut itaque magni.",54
"Sapiente enim et qui placeat.",51
"Quia expedita cum eum quis.",56
"Suscipit sed non quae aut.",52
"Laborum atque omnis ullam sunt.",48
"Veniam distinctio iusto laudantium qui.",55
"Modi voluptate eligendi asperiores eum.",57
"Molestiae dolores fuga aut ut.",69
"Deleniti architecto quidem ea quia.",61
"Facere mollitia eum sint suscipit.",78
"Veritatis sit sint aut rem.",53
"Minus inventore tempore perspiciatis aut.",59
"Expedita accusantium dolore eos nostrum.",68
"Et omnis aliquid quia doloremque.",65
"Suscipit consequuntur excepturi consequatur quae.",57
"Pariatur sequi modi qui dolores.",63
"Quam molestias eos sint similique.",54
"Ipsum ut alias natus impedit.",59
"Vero qui perspiciatis deleniti dignissimos.",64
"Ex quaerat doloribus quia suscipit.",59
"Itaque sint dignissimos quis sit.",64
"Doloribus atque fugit blanditiis unde.",53
"Unde quia magni quis et.",56
"Aliquam quo rerum tenetur dolore.",53
"Doloribus sapiente architecto nulla et.",57
"Recusandae soluta autem culpa sunt.",49
"Dolores excepturi ipsam facere doloremque.",63
"Et sed ut nemo est.",54
"Ipsa ut blanditiis itaque velit.",54
"Autem aut officia officia nihil.",60
"Natus atque officiis molestias impedit.",55
"Quae adipisci omnis nam expedita.",64
"Quod repudiandae quae vero velit.",61
"Sequi ad inventore atque omnis.",63
"Perferendis consequatur mollitia voluptatum officiis.",54
"Sit magni molestiae cum sed.",51
"Odio odit modi ut possimus.",63
"Voluptatem facilis quia itaque cupiditate.",57
"Soluta eum quia ullam dicta.",60
"Aut voluptas totam consequatur natus.",64
"Dicta fugit nesciunt consequatur consequatur.",65
"Amet ipsum inventore voluptatem enim.",62
"Nihil et repellat omnis eveniet.",66
"Reprehenderit nihil atque sint veritatis.",58
"In corrupti laborum id recusandae.",52
"Placeat amet accusantium cupiditate quis.",61
"Delectus est molestiae quas perspiciatis.",69
"Dolorem deleniti sunt reprehenderit alias.",65
"Necessitatibus ut explicabo ullam sed.",57
"Et eius quod minus aut.",55
"Vel aliquam animi voluptas mollitia.",48
"Laboriosam soluta dignissimos nulla maiores.",53
"Id totam magnam ut qui.",78
"Incidunt sequi voluptatum inventore id.",59
"Unde consequuntur sed quas et.",65
"Mollitia magni soluta voluptatem ut.",45
"Ut ea deleniti suscipit qui.",56
"Odio aut dolores asperiores molestiae.",67
"Et eum qui officiis dicta.",54
"Odit ea ea non soluta.",58
"Assumenda aut dolorem magnam consequuntur.",64
"Laboriosam eos aut nihil rerum.",59
"Tenetur molestiae distinctio enim quae.",59
"Consectetur incidunt aut suscipit dolores.",56
"Dolores ipsa deserunt repellendus excepturi.",54
"Eveniet ratione est corporis vel.",69
"Non illum voluptas tenetur beatae.",62
"Provident sed quasi sit eum.",60
"Nemo quo sed nihil voluptatibus.",58
"Perspiciatis provident voluptatem beatae iste.",65
"Nemo sit dolor libero maiores.",46
"Maiores aut placeat neque sequi.",71
"Unde consequuntur non minima et.",67
"Alias facere sapiente ducimus dolore.",66
"Vero similique accusamus et minus.",53
"Sit doloribus dicta occaecati omnis.",67
"Numquam aut animi rerum assumenda.",59
"Accusantium delectus sed cum consequatur.",55
"Corporis omnis eum non minima.",71
"Neque eum qui eaque quis.",68
"Accusamus odit rem nihil molestias.",60
"Officiis perferendis enim soluta perspiciatis.",55
"In asperiores delectus soluta ex.",62
"Voluptatem deleniti et modi rerum.",63
"Dolor voluptatem aperiam quo sunt.",74
"Sint aut dolore modi illo.",68
"Beatae quia corrupti quam voluptas.",48
"Iure ea ab quo est.",48
"Illum sint illo quia quasi.",57
"Vel quasi architecto occaecati iure.",64
"Omnis et placeat nisi eveniet.",68
"Assumenda commodi nemo quo pariatur.",56
"Nostrum non magnam velit modi.",57
"Architecto hic magnam perspiciatis assumenda.",63
"Exercitationem nihil corrupti porro perferendis.",53
"Fugit consequatur earum laboriosam id.",55
"Earum vitae dolorum tenetur ut.",58
"Est at ea in ut.",58
"Enim in minus sed corrupti.",56
"Aut neque sit minus fugit.",54
"Repudiandae eum explicabo dolores quia.",57
"Sed rerum soluta impedit voluptatem.",55
"Et libero libero eos esse.",48
"Distinctio inventore consequatur et fuga.",52
"Voluptas mollitia consequatur quo sequi.",67
"Dolores assumenda magnam tenetur nihil.",64
"Sit voluptas ipsam et officiis.",70
"Consectetur incidunt nulla et corrupti.",54
"Aliquid et natus hic nihil.",61
"Commodi sapiente non iure fuga.",61
"Deleniti et corporis repellendus cupiditate.",75
"Cum molestiae velit aut ea.",63
"Quos reiciendis nesciunt velit minima.",49
"Autem vel nisi odio aperiam.",61
"Aut doloribus delectus molestiae totam.",56
"Assumenda cum deleniti quod rem.",70
"Quidem exercitationem placeat voluptas fugiat.",66
"Ut aut quis debitis cupiditate.",70
"Ipsa ut omnis sint facilis.",57
"Nisi enim alias beatae ad.",60
"Eum id fugit voluptates voluptas.",55
"Adipisci sit optio doloribus iure.",43
"Laudantium adipisci modi voluptates sit.",55
"Sequi consequatur iste porro sapiente.",68
"Quo voluptatem eaque magnam consectetur.",56
"Ullam nihil quasi eaque quas.",68
"Et dolores velit eligendi delectus.",64
"Et repellendus asperiores odio atque.",51
"Consequatur dolore eos occaecati soluta.",64
"Quia aut modi tempora sapiente.",66
"Deserunt ut est autem asperiores.",50
"Eos iure consequatur quibusdam quibusdam.",51
"Qui modi sed et sed.",58
"A et in consequatur voluptas.",63
"Quasi explicabo illo omnis et.",44
"Magni voluptate aperiam in veniam.",58
"Nihil voluptas magni et ducimus.",66
"Repellendus laboriosam dolor sunt fuga.",57
"Ipsam quis autem explicabo qui.",71
"In reiciendis et nihil id.",57
"Magnam veritatis maxime vel quia.",70
"Voluptatem accusamus est quaerat quidem.",52
"Aut autem culpa consectetur ea.",68
"Illo minus ut provident nemo.",69
"Sit qui ut dolores voluptatem.",56
"Adipisci ut quod omnis consequatur.",46
"Dolorum dolor est saepe amet.",72
"Omnis explicabo dolorum maiores quo.",65
"Maxime tempora molestiae eligendi quis.",61
"Aut accusantium repellat accusamus expedita.",51
"Quidem et voluptates iste doloremque.",60
"Velit veniam delectus facilis molestias.",62
"Omnis aliquam neque ut dolorum.",68
"Distinctio vel et doloremque ab.",65
"Earum voluptatem omnis velit commodi.",75
"Sit totam placeat omnis omnis.",51
"Et qui eveniet veritatis sequi.",66
"Nostrum quisquam sed hic autem.",73
"Ut dolores iure saepe et.",62
"Amet soluta consequatur incidunt quia.",69
"Rem incidunt consequatur facilis numquam.",60
"Quia officia non in rerum.",54
"Provident qui at rerum sapiente.",60
"Quas et debitis ipsum aut.",65
"Dolores ipsum non dolores voluptatem.",60
"Velit et quia neque magnam.",43
"Dolor impedit quia quos ipsum.",59
"Minus laborum ut sit vel.",58
"Temporibus et id et sint.",72
"Omnis eum ipsum est labore.",60
"Provident et non soluta voluptates.",51
"Non fuga corrupti consectetur pariatur.",55
"Dolor deleniti quasi laboriosam delectus.",63
"Blanditiis quo voluptatum inventore officiis.",52
"Et occaecati saepe et eius.",65
"Similique et id nemo aut.",62
"Corrupti natus sapiente est non.",68
"Recusandae recusandae rerum aliquid non.",61
"Ducimus dolorem sed quod adipisci.",53
"Ad voluptatibus praesentium et voluptatem.",60
"Ab omnis corrupti aut aut.",49
"Laboriosam quas tenetur sit est.",50
"Tenetur et earum voluptatum consequatur.",56
"Omnis laborum voluptatem in aut.",57
"Velit et eos non sint.",60
"Quisquam explicabo dicta nemo quia.",60
"Harum tempore deleniti delectus repellat.",62
"Et distinctio cupiditate dolores aut.",61
"Molestias iure neque odio doloribus.",62
"Nesciunt earum necessitatibus cupiditate nihil.",59
"Hic earum perspiciatis porro aut.",65
"Quis deleniti veritatis ea mollitia.",63
"Et atque quo voluptatem cupiditate.",61
"Numquam facilis porro voluptate odio.",60
"Non alias et doloribus iure.",56
"Ducimus ut omnis qui quos.",67
"Consequuntur labore a vel eveniet.",57
"Maxime libero totam et fugiat.",55
"Error adipisci officiis veniam voluptatem.",72
"Quo excepturi veritatis repudiandae animi.",50
"Nihil unde sed quisquam consequatur.",46
"Autem quos recusandae aut eum.",51
"Vel veritatis fugit reiciendis ullam.",58
"Iste beatae sint quia veniam.",57
"Voluptas nihil et natus consequatur.",43
"Fugiat aspernatur sint at vitae.",52
"Non quidem accusamus tenetur voluptas.",72
"Aspernatur et ex nihil iste.",71
"Fugit sed est tempore aut.",59
"Omnis consectetur nam qui incidunt.",47
"Quas qui sit cumque quis.",64
"Dolorem nam nam iusto consectetur.",53
"Consectetur voluptatem maiores dolore ut.",51
"Qui facilis earum ut in.",68
"Maiores consequatur corporis id harum.",64
"Quis ut quia at itaque.",71
"Maiores est maxime id minus.",63
"Dolores id unde quo possimus.",68
"In id eum sed libero.",67
"Sed officiis quo et eius.",64
"Fuga mollitia quia doloremque omnis.",64
"Eum voluptatem accusantium modi consequatur.",72
"Placeat exercitationem veritatis voluptatum ratione.",53
"Enim consequuntur provident enim cupiditate.",63
"Et nulla dolorem labore laboriosam.",51
"Blanditiis porro voluptas qui suscipit.",48
"Ut architecto reprehenderit quia rerum.",54
"Omnis voluptate aliquid commodi fuga.",65
"Voluptatem provident est nam rerum.",58
"Impedit culpa nisi consequatur id.",81
"Vero in quidem sit ut.",77
"Facilis qui ipsum porro consectetur.",63
"Et voluptate et assumenda voluptatibus.",54
"Quaerat fuga officiis illum eligendi.",57
"Dicta ullam facilis sit est.",51
"Facere pariatur consectetur nemo consequatur.",65
"Et omnis aliquid nisi libero.",70
"Et neque sed aliquid assumenda.",54
"Ducimus officiis et id quibusdam.",55
"Dolor laborum doloribus doloribus omnis.",59
"Veritatis nemo reprehenderit id rem.",72
"Eos inventore placeat quidem esse.",63
"Deleniti quis autem recusandae aut.",69
"Fugit optio quis et delectus.",51
"Doloribus rerum nihil et iusto.",55
"A laborum eligendi qui molestiae.",76
"Mollitia atque aperiam qui maxime.",64
"Eum libero id quos sint.",62
"Alias veritatis id ipsam ut.",44
"Ut fuga est vel est.",67
"Rerum nostrum quibusdam laboriosam consequatur.",69
"Fugit consectetur itaque similique sit.",68
"Qui sint cupiditate eaque laborum.",68
"Aliquid maxime doloribus modi voluptatum.",54
"Aut corrupti explicabo ut aut.",51
"Quis laudantium pariatur voluptas at.",68
"Omnis voluptas occaecati quae qui.",67
"Vitae eius nam qui quos.",54
"Tenetur ducimus laudantium molestias aut.",61
"Necessitatibus sunt voluptas aut hic.",71
"Ut neque in similique et.",72
"Iste ex exercitationem et et.",66
"Qui eligendi maiores modi quod.",66
"Ab vero ab accusamus dolores.",54
"Dignissimos asperiores et voluptate suscipit.",48
"Suscipit fugit vitae repellendus atque.",61
"Autem asperiores quisquam est nam.",63
"Accusamus totam cum odio accusantium.",55
"Atque necessitatibus labore id et.",54
"Sequi facilis incidunt delectus voluptas.",60
"Eligendi similique voluptatem qui in.",58
"Quia et quia minima voluptatem.",57
"Nihil quaerat illum provident ex.",73
"Velit facilis quod et animi.",60
"Aperiam possimus minima eveniet similique.",44
"Debitis placeat doloremque necessitatibus laudantium.",67
"Quia officia facilis nihil harum.",67
"Quod illo dolor voluptas corporis.",64
"Placeat recusandae maiores occaecati consequatur.",54
"Exercitationem consequatur reprehenderit dolor voluptate.",58
"Maiores aperiam provident aliquam modi.",53
"Ut inventore ullam nisi sed.",67
"Ea pariatur voluptas corrupti nisi.",73
"Ea voluptatem enim saepe ad.",51
"Repellendus qui officiis provident ad.",55
"Quae non adipisci in quas.",67
"Sint natus ullam in commodi.",54
"Est iusto ex amet numquam.",62
"Minima et voluptatibus labore et.",63
"Sed est a ea praesentium.",50
"Cumque ea magnam dignissimos quia.",49
"Assumenda qui animi et omnis.",57
"Deserunt mollitia fugiat natus iusto.",51
"Atque veniam sint quaerat autem.",55
"Explicabo nisi quia odio placeat.",64
"Fugiat quo exercitationem sed ut.",73
"Est esse laboriosam id deleniti.",58
"Dicta quasi est quam et.",68
"Voluptatem omnis corrupti non inventore.",64
"Aut laudantium sed non quos.",69
"Sed cum vel non suscipit.",76
"Aut autem praesentium voluptas tenetur.",64
"Sit modi architecto consequatur et.",52
"Eum et magni consequuntur modi.",54
"Tempora voluptate cum delectus doloribus.",51
"Totam quisquam autem iste voluptatem.",52
"Fuga asperiores quibusdam sit voluptatem.",58
"Facere voluptate sequi ducimus tempora.",68
"Error eos minus numquam at.",55
"Nemo et eius vitae id.",57
"Ex veritatis quod consectetur consectetur.",59
"Officiis qui sapiente aliquid odit.",65
"Saepe rerum vel beatae tenetur.",60
"Sapiente nisi aliquam nobis ut.",65
"Perspiciatis sint voluptatum at quam.",49
"Commodi asperiores sint quis ad.",85
"Aliquam consequatur quis ut voluptatum.",54
"Eum iure et velit illum.",70
"Odit et qui suscipit sunt.",59
"Praesentium sint aut sequi in.",84
"Hic voluptatem non tempora aliquid.",66
"Voluptas rerum harum est sit.",56
"Sit magnam optio eligendi praesentium.",67
"Quia veritatis labore et necessitatibus.",58
"Et consectetur aut voluptatibus aliquid.",59
"Consequuntur repellendus ipsa ab illo.",55
"Commodi culpa consequuntur quas recusandae.",59
"Officia voluptates et animi autem.",55
"Quasi vitae aut quae officiis.",64
"Quia aut dolores amet quas.",56
"Non ut dicta vel enim.",57
"Placeat voluptatum tempora ut dolore.",56
"Exercitationem sapiente deserunt et voluptatem.",55
"Accusantium ad consequuntur aperiam qui.",52
"Consequuntur accusantium rerum voluptatem ea.",68
"Aliquam non dolor harum velit.",63
"Repellat commodi quae eos sunt.",60
"Sunt nobis dolorem pariatur cumque.",62
"Cumque repellendus modi asperiores repudiandae.",64
"Est repudiandae molestias ex autem.",63
"Et cum eligendi et sed.",58
"Voluptatem quae pariatur qui ea.",56
"Sed ea quis ut et.",74
"Omnis sunt laborum repudiandae aut.",51
"Eos totam magni placeat nostrum.",55
"Facilis est aliquam voluptas dolore.",38
"Qui alias deleniti sit est.",66
"Commodi ipsum fugiat modi earum.",63
"Provident fugiat totam nobis rem.",66
"Et sunt modi consequatur ab.",64
"Ad fuga voluptatum illo qui.",58
"Alias ut eum et non.",57
"Assumenda recusandae praesentium culpa alias.",60
"Perferendis adipisci officia laboriosam voluptas.",65
"Voluptatum tempore itaque officiis expedita.",58
"Recusandae voluptatum doloremque deserunt rerum.",48
"Fugit omnis sed id deserunt.",55
"Ex atque perferendis temporibus assumenda.",79
"Enim nesciunt qui non enim.",58
"Eum dolorem et pariatur voluptatem.",56
"Dolore rerum sunt esse quae.",69
"Ab mollitia est aperiam perferendis.",57
"Itaque sunt eos aspernatur sit.",57
"Tempore tenetur non id quam.",68
"Molestiae quibusdam magnam sit perferendis.",59
"Qui eum et assumenda necessitatibus.",71
"Laboriosam possimus qui et et.",50
"Fugit maxime ipsa repellendus quo.",66
"Aut occaecati quas quia eum.",58
"Et sit occaecati dolorem architecto.",64
"Dignissimos nemo est incidunt sequi.",73
"Blanditiis sequi dignissimos quis id.",50
"Sunt autem aut blanditiis aut.",49
"Quia suscipit molestias asperiores temporibus.",62
"Laudantium ipsum non enim sit.",46
"Dolorem nam doloremque aut aut.",78
"Facilis iste quaerat ea qui.",73
"Repellendus molestiae eos in in.",60
"Et in vel iste magnam.",68
"Sit autem quia nam quos.",53
"Voluptatum libero esse ipsam magnam.",78
"Inventore veritatis est recusandae illo.",49
"Ut earum ut tempora consequatur.",64
"Omnis quas a blanditiis aperiam.",61
"Ea quas quasi non maxime.",63
"Quae quae sapiente et rerum.",65
"Voluptatem numquam et nam cupiditate.",62
"Commodi voluptate eum eveniet vero.",59
"Vel animi soluta pariatur animi.",62
"Dolorem rerum iusto quis qui.",51
"Similique quia eius pariatur qui.",54
"Beatae sequi similique iste ipsa.",56
"Iusto quo laudantium facere ea.",51
"Similique quisquam deleniti deleniti in.",52
"Inventore ipsam quas laudantium eius.",70
"Sint eos non saepe quo.",64
"Mollitia qui iusto omnis reiciendis.",59
"Consequatur numquam rem itaque molestiae.",61
"Tempore perspiciatis repellendus sint impedit.",67
"Placeat temporibus laudantium sed vel.",65
"Ut quod quisquam quia quia.",69
"Facilis rerum voluptatibus quis natus.",67
"Ut alias ad aut iste.",58
"Impedit et modi nulla veritatis.",54
"Unde porro nostrum sed quae.",62
"Molestiae pariatur dolor est enim.",58
"Dolores ut voluptatem laboriosam id.",56
"Aliquid et tempora et esse.",56
"Blanditiis autem blanditiis praesentium dolor.",65
"Laboriosam voluptas reiciendis perferendis nobis.",57
"Voluptates ipsum voluptas explicabo temporibus.",66
"Ea sit assumenda aut iusto.",65
"Ab dolorem est mollitia perspiciatis.",52
"Commodi itaque voluptas rem error.",47
"Est magni ducimus ducimus exercitationem.",60
"Fugiat sunt sint quia quod.",66
"Quasi iusto beatae sit perspiciatis.",53
"Laboriosam autem dignissimos sint eaque.",72
"Commodi ipsum aperiam qui voluptatum.",53
"Velit atque quia saepe rem.",57
"Consequatur blanditiis qui cum voluptas.",61
"Eius qui optio ratione odio.",63
"Eum nobis deserunt et magnam.",57
"Voluptates est autem aut tempora.",58
"Quia sunt dolor dolores illum.",58
"Sint adipisci modi autem eos.",49
"Enim dolores voluptas hic perspiciatis.",66
"Optio commodi quas recusandae corrupti.",61
"Quasi officia ea quas deserunt.",53
"Veritatis impedit esse temporibus laudantium.",41
"Nobis voluptatem in delectus corrupti.",48
"Culpa voluptatem eius commodi officiis.",57
"Eveniet tenetur non quia perferendis.",57
"Enim dolorem facilis modi voluptatem.",53
"Aut aut est in labore.",54
"Id voluptas sed eum commodi.",55
"Voluptas tempora at amet nostrum.",66
"Eos consequatur autem fugit fugit.",59
"In esse fugiat velit sed.",59
"Ducimus non vitae esse dolorem.",56
"Sit omnis occaecati eum voluptates.",58
"Magnam non ea rerum ut.",49
"Asperiores dolorum tempore animi deserunt.",58
"Suscipit libero quos magni exercitationem.",47
"Et vel tempore odit temporibus.",65
"Est sed adipisci libero tempore.",54
"Recusandae unde fuga expedita nesciunt.",62
"Dolorem animi eum excepturi facere.",67
"Quasi qui doloribus corporis voluptas.",61
"Dolores molestiae culpa asperiores et.",59
"Recusandae et suscipit illo similique.",69
"Et dicta sint mollitia et.",60
"Dignissimos ea cum ipsa et.",63
"Id magni officia tenetur dicta.",44
"Ut quo recusandae deserunt commodi.",42
"Fugiat illum voluptatem id et.",60
"Excepturi est non ex explicabo.",61
"Distinctio aut rerum qui perferendis.",64
"Dolores impedit vel aut provident.",57
"Aut id alias possimus praesentium.",67
"Quis omnis exercitationem quia animi.",59
"Eveniet et est tenetur modi.",74
"Natus doloremque quo nam omnis.",57
"Iusto et et sint quia.",61
"Veritatis ea et et quis.",54
"Tempora voluptatum sint quia voluptate.",60
"Rerum voluptate sequi impedit odio.",45
"Est quidem repellendus modi et.",68
"Et perferendis dolores aspernatur molestiae.",67
"Modi et est mollitia officia.",65
"Totam quos sunt illo assumenda.",71
"Est voluptas recusandae autem repudiandae.",58
"Labore consequatur ab molestiae laborum.",61
"Neque sint velit quos doloribus.",72
"Quam ipsam ut delectus deserunt.",57
"Occaecati rerum reprehenderit voluptatum cum.",58
"Delectus sunt vero corporis omnis.",61
"Odio officia voluptatem voluptatem praesentium.",61
"Enim perspiciatis sapiente voluptates est.",58
"At hic quis consequuntur unde.",64
"Et omnis architecto maxime magni.",60
"Exercitationem architecto temporibus eum aperiam.",53
"Hic veritatis minima ut ut.",51
"Eos provident dolorem illum harum.",70
"Repellendus ea quaerat quo quia.",68
"Temporibus aut et reprehenderit culpa.",55
"Corrupti et rerum et esse.",63
"Atque sunt corrupti aperiam hic.",57
"Dolorem suscipit architecto adipisci aut.",55
"Debitis officiis consequuntur in modi.",59
"Eveniet sed aut corrupti quia.",65
"Sit accusamus qui aut hic.",67
"Deserunt quas quis est quas.",60
"Repellat eaque et magnam consequatur.",56
"Magnam maiores qui mollitia maxime.",50
"Reiciendis et ipsam at ad.",55
